{
  "$schema": "https://json-schema.org/draft/2020-12/schema",
  "$id": "https://skenion.dev/schemas/graph/v0.1/fragment.schema.json",
  "title": "Skenion Graph Fragment v0.1",
  "type": "object",
  "required": ["schema", "schemaVersion", "nodes", "edges"],
  "properties": {
    "schema": {
      "const": "skenion.graph.fragment"
    },
    "schemaVersion": {
      "const": "0.1.0"
    },
    "id": {
      "type": "string",
      "minLength": 1
    },
    "nodes": {
      "type": "array",
      "items": {
        "$ref": "https://skenion.dev/schemas/graph/v0.1/graph.schema.json#/$defs/node"
      }
    },
    "edges": {
      "type": "array",
      "items": {
        "$ref": "https://skenion.dev/schemas/graph/v0.1/graph.schema.json#/$defs/edge"
      }
    },
    "view": {
      "$ref": "#/$defs/fragmentView"
    },
    "omittedEdges": {
      "type": "array",
      "items": {
        "$ref": "#/$defs/omittedEdge"
      }
    },
    "metadata": {
      "type": "object",
      "additionalProperties": true
    }
  },
  "additionalProperties": false,
  "$defs": {
    "fragmentView": {
      "type": "object",
      "properties": {
        "nodes": {
          "type": "object",
          "additionalProperties": {
            "$ref": "#/$defs/nodeView"
          }
        }
      },
      "additionalProperties": false
    },
    "nodeView": {
      "type": "object",
      "required": ["x", "y"],
      "properties": {
        "x": {
          "type": "number"
        },
        "y": {
          "type": "number"
        },
        "width": {
          "type": "number"
        },
        "height": {
          "type": "number"
        },
        "collapsed": {
          "type": "boolean"
        }
      },
      "additionalProperties": false
    },
    "omittedEdge": {
      "type": "object",
      "required": ["id", "source", "target", "reason"],
      "properties": {
        "id": {
          "type": "string",
          "minLength": 1
        },
        "source": {
          "$ref": "https://skenion.dev/schemas/graph/v0.1/graph.schema.json#/$defs/portEndpoint"
        },
        "target": {
          "$ref": "https://skenion.dev/schemas/graph/v0.1/graph.schema.json#/$defs/portEndpoint"
        },
        "reason": {
          "enum": ["outside-fragment", "policy-omit"]
        }
      },
      "additionalProperties": false
    }
  }
}
